{
  "schema_version": "1.0.0",
  "id": "selection-decision-application:60000000-0000-5000-8000-000000000001",
  "entity_type": "selection_decision_application",
  "phase_id": "MUSEUM-03B",
  "application_status": "applied",
  "submitted_decision_id": "selection-decision:50000000-0000-5000-8000-000000000001",
  "submitted_decision_hash": "sha256:aaaaaaaaaaaaaaaaaaaaaaaaaaaaaaaaaaaaaaaaaaaaaaaaaaaaaaaaaaaaaaaa",
  "input_bundle_id": "selection-review-bundle:40000000-0000-5000-8000-000000000001",
  "input_bundle_hash": "sha256:bbbbbbbbbbbbbbbbbbbbbbbbbbbbbbbbbbbbbbbbbbbbbbbbbbbbbbbbbbbbbbbb",
  "recommended_slate_id": "selection-scenario:40000000-0000-5000-8000-000000000004",
  "recommended_slate_hash": "sha256:cccccccccccccccccccccccccccccccccccccccccccccccccccccccccccccccc",
  "selected_candidate_ids": [
    "artist-candidate:10000000-0000-5000-8000-000000000001",
    "artist-candidate:10000000-0000-5000-8000-000000000002",
    "artist-candidate:10000000-0000-5000-8000-000000000003",
    "artist-candidate:10000000-0000-5000-8000-000000000004",
    "artist-candidate:10000000-0000-5000-8000-000000000005",
    "artist-candidate:10000000-0000-5000-8000-000000000006",
    "artist-candidate:10000000-0000-5000-8000-000000000007",
    "artist-candidate:10000000-0000-5000-8000-000000000008",
    "artist-candidate:10000000-0000-5000-8000-000000000009",
    "artist-candidate:10000000-0000-5000-8000-000000000010",
    "artist-candidate:10000000-0000-5000-8000-000000000011",
    "artist-candidate:10000000-0000-5000-8000-000000000012"
  ],
  "candidate_input_hashes": [
    {"candidate_id": "artist-candidate:10000000-0000-5000-8000-000000000001", "canonical_hash": "sha256:0000000000000000000000000000000000000000000000000000000000000001"},
    {"candidate_id": "artist-candidate:10000000-0000-5000-8000-000000000002", "canonical_hash": "sha256:0000000000000000000000000000000000000000000000000000000000000002"},
    {"candidate_id": "artist-candidate:10000000-0000-5000-8000-000000000003", "canonical_hash": "sha256:0000000000000000000000000000000000000000000000000000000000000003"},
    {"candidate_id": "artist-candidate:10000000-0000-5000-8000-000000000004", "canonical_hash": "sha256:0000000000000000000000000000000000000000000000000000000000000004"},
    {"candidate_id": "artist-candidate:10000000-0000-5000-8000-000000000005", "canonical_hash": "sha256:0000000000000000000000000000000000000000000000000000000000000005"},
    {"candidate_id": "artist-candidate:10000000-0000-5000-8000-000000000006", "canonical_hash": "sha256:0000000000000000000000000000000000000000000000000000000000000006"},
    {"candidate_id": "artist-candidate:10000000-0000-5000-8000-000000000007", "canonical_hash": "sha256:0000000000000000000000000000000000000000000000000000000000000007"},
    {"candidate_id": "artist-candidate:10000000-0000-5000-8000-000000000008", "canonical_hash": "sha256:0000000000000000000000000000000000000000000000000000000000000008"},
    {"candidate_id": "artist-candidate:10000000-0000-5000-8000-000000000009", "canonical_hash": "sha256:0000000000000000000000000000000000000000000000000000000000000009"},
    {"candidate_id": "artist-candidate:10000000-0000-5000-8000-000000000010", "canonical_hash": "sha256:000000000000000000000000000000000000000000000000000000000000000a"},
    {"candidate_id": "artist-candidate:10000000-0000-5000-8000-000000000011", "canonical_hash": "sha256:000000000000000000000000000000000000000000000000000000000000000b"},
    {"candidate_id": "artist-candidate:10000000-0000-5000-8000-000000000012", "canonical_hash": "sha256:000000000000000000000000000000000000000000000000000000000000000c"}
  ],
  "resolved_artists": [
    {"candidate_id": "artist-candidate:10000000-0000-5000-8000-000000000001", "labels": {"en": "Synthetic Artist 1", "zh-Hans": "合成艺术家1"}},
    {"candidate_id": "artist-candidate:10000000-0000-5000-8000-000000000002", "labels": {"en": "Synthetic Artist 2", "zh-Hans": "合成艺术家2"}},
    {"candidate_id": "artist-candidate:10000000-0000-5000-8000-000000000003", "labels": {"en": "Synthetic Artist 3", "zh-Hans": "合成艺术家3"}},
    {"candidate_id": "artist-candidate:10000000-0000-5000-8000-000000000004", "labels": {"en": "Synthetic Artist 4", "zh-Hans": "合成艺术家4"}},
    {"candidate_id": "artist-candidate:10000000-0000-5000-8000-000000000005", "labels": {"en": "Synthetic Artist 5", "zh-Hans": "合成艺术家5"}},
    {"candidate_id": "artist-candidate:10000000-0000-5000-8000-000000000006", "labels": {"en": "Synthetic Artist 6", "zh-Hans": "合成艺术家6"}},
    {"candidate_id": "artist-candidate:10000000-0000-5000-8000-000000000007", "labels": {"en": "Synthetic Artist 7", "zh-Hans": "合成艺术家7"}},
    {"candidate_id": "artist-candidate:10000000-0000-5000-8000-000000000008", "labels": {"en": "Synthetic Artist 8", "zh-Hans": "合成艺术家8"}},
    {"candidate_id": "artist-candidate:10000000-0000-5000-8000-000000000009", "labels": {"en": "Synthetic Artist 9", "zh-Hans": "合成艺术家9"}},
    {"candidate_id": "artist-candidate:10000000-0000-5000-8000-000000000010", "labels": {"en": "Synthetic Artist 10", "zh-Hans": "合成艺术家10"}},
    {"candidate_id": "artist-candidate:10000000-0000-5000-8000-000000000011", "labels": {"en": "Synthetic Artist 11", "zh-Hans": "合成艺术家11"}},
    {"candidate_id": "artist-candidate:10000000-0000-5000-8000-000000000012", "labels": {"en": "Synthetic Artist 12", "zh-Hans": "合成艺术家12"}}
  ],
  "application_timestamp": "2026-07-13T04:00:00Z",
  "applying_tool": {"name": "museum_pipeline.curation.apply_selection_decision", "version": "1.0.0", "code_commit": "aaaaaaaaaaaaaaaaaaaaaaaaaaaaaaaaaaaaaaaa"},
  "validation_result": "pass",
  "stale_check": {"status": "fresh", "bundle_revalidated": true, "decision_hash_verified": true},
  "replacement_count": 0,
  "media_strategy": "mixed",
  "media_execution_default": "metadata_first",
  "public_scope": {"artist_metadata": true, "artwork_metadata": true, "media": "mixed"},
  "authority": "Mays",
  "resulting_batch_id": "art-batch:synthetic-first-slate-v1",
  "application_basis_hash": "sha256:dddddddddddddddddddddddddddddddddddddddddddddddddddddddddddddddd",
  "audit_log": [
    {"event": "bundle_validated", "status": "pass", "recorded_at": "2026-07-13T04:00:00Z"},
    {"event": "decision_validated", "status": "pass", "recorded_at": "2026-07-13T04:00:00Z"},
    {"event": "selection_locked", "status": "pass", "recorded_at": "2026-07-13T04:00:00Z"},
    {"event": "decision_applied", "status": "pass", "recorded_at": "2026-07-13T04:00:00Z"}
  ]
}
