{"application_basis_hash":"sha256:6eab3c70f56a2b77006888edec7e421e4af59f99c1a637ee66e9267282f205cd","application_status":"applied","application_timestamp":"2026-07-13T04:00:21.816946Z","applying_tool":{"code_commit":"81ca9d28cfb16f971a582497448d30cd0579ee6c","name":"museum_pipeline.curation.apply_selection_decision","version":"1.0.0"},"audit_log":[{"event":"bundle_validated","recorded_at":"2026-07-13T04:00:21.816946Z","status":"pass"},{"event":"decision_validated","recorded_at":"2026-07-13T04:00:21.816946Z","status":"pass"},{"event":"selection_locked","recorded_at":"2026-07-13T04:00:21.816946Z","status":"pass"},{"event":"decision_applied","recorded_at":"2026-07-13T04:00:21.816946Z","status":"pass"}],"authority":"Mays","candidate_input_hashes":[{"candidate_id":"artist-candidate:aba4e7b5-5cce-5903-98a3-debd6a8a30fe","canonical_hash":"sha256:03a86449952dddda9c2f2e35ae0f30ac3361b3472f8be4db385510dc276354aa"},{"candidate_id":"artist-candidate:28386296-3385-5ef8-a959-9f1ef8ae7bc9","canonical_hash":"sha256:de4b5c99482b2d641d8c66b7432de9c042b43b4f20dd83e60a0b78a7b42d133c"},{"candidate_id":"artist-candidate:708f8528-dbac-53f5-8fc7-bb15e816c0a5","canonical_hash":"sha256:4d79056dab02a5afc17f243126fe36fcb995057ef6e56bea640de8d0ea713119"},{"candidate_id":"artist-candidate:f92e77cc-b45b-5998-9707-879503c1dabf","canonical_hash":"sha256:b176a8488b921f141f43d3f3b910f58cbac2ea9704eae01c782b1b329847175a"},{"candidate_id":"artist-candidate:09ae6255-0541-57ef-9dcd-df1570ff2d62","canonical_hash":"sha256:d420f23c32c340d7653f89e116e1e824d69bc4a103669ca81373ab4698b17d65"},{"candidate_id":"artist-candidate:f1757502-ff5e-5769-857a-e7e53cec7c60","canonical_hash":"sha256:a7370809bbb9b5d0a3735d0e269e5f1cbb756e13f3172b136f5e7f2995a12b20"},{"candidate_id":"artist-candidate:1942ecb6-ca0e-58c5-9fca-7785d500b8cf","canonical_hash":"sha256:c14bcf01d7b484f3b05220bb792ff1e9b0fa52eb80538fb72191c5369628f10d"},{"candidate_id":"artist-candidate:0ca3f12a-9ae9-5644-916f-3d599f1967f8","canonical_hash":"sha256:0c656ccc74bcc5a42f7dc1b3434ec5b35d126b84ebbc42d35a47b7a9977cca25"},{"candidate_id":"artist-candidate:da02db61-430f-5d73-a97f-64b0e7a5ce26","canonical_hash":"sha256:b0e6cc36412870668b2b725dcb5013ff72c33512c7b6099758460f8b22f709eb"},{"candidate_id":"artist-candidate:f25c47aa-47bd-5009-b3fe-508b6cc9b039","canonical_hash":"sha256:1a9a8139841cd1ccaad48417146e45c0baab13076c7c008897029a15946e96fa"},{"candidate_id":"artist-candidate:ad5f2cda-6489-55d4-aa81-37be10697f58","canonical_hash":"sha256:12492233259be52a7e2da0ab2c90051b4b007533363f4aceee5b07d11c83859a"},{"candidate_id":"artist-candidate:0bfcdd78-5be2-5903-9819-d3a3a1406698","canonical_hash":"sha256:77b9f26813bbfa8200e74c7264924066c7f6bd9ddae8feaaaf361de6e01b9cc8"}],"entity_type":"selection_decision_application","id":"selection-decision-application:8c2666ef-fdfe-5250-af97-1d3b1d8c4a43","input_bundle_hash":"sha256:ba7640dbfe554c938fc9bf65ac5fa1eb42514ced015e0b4e56598870428072c7","input_bundle_id":"selection-review-bundle:3843c34b-7a65-5581-baec-1385d53326c5","media_execution_default":"metadata_first","media_strategy":"mixed","phase_id":"MUSEUM-03B","public_scope":{"artist_metadata":true,"artwork_metadata":true,"media":"mixed"},"recommended_slate_hash":"sha256:b595d6b558d110111597f6edfd7273e2446519fdfc4dab919c59384e04e3c645","recommended_slate_id":"selection-scenario:8966bf75-2830-5a0f-afc5-5d6801e93ccc","replacement_count":0,"resolved_artists":[{"candidate_id":"artist-candidate:aba4e7b5-5cce-5903-98a3-debd6a8a30fe","labels":{"en":"Albrecht Dürer","zh-Hans":"阿尔布雷希特·丢勒"}},{"candidate_id":"artist-candidate:28386296-3385-5ef8-a959-9f1ef8ae7bc9","labels":{"en":"Francisco de Goya","zh-Hans":"弗朗西斯科·戈雅"}},{"candidate_id":"artist-candidate:708f8528-dbac-53f5-8fc7-bb15e816c0a5","labels":{"en":"Vincent van Gogh","zh-Hans":"文森特·梵高"}},{"candidate_id":"artist-candidate:f92e77cc-b45b-5998-9707-879503c1dabf","labels":{"en":"Mary Cassatt","zh-Hans":"玛丽·卡萨特"}},{"candidate_id":"artist-candidate:09ae6255-0541-57ef-9dcd-df1570ff2d62","labels":{"en":"Käthe Kollwitz","zh-Hans":"凯绥·珂勒惠支"}},{"candidate_id":"artist-candidate:f1757502-ff5e-5769-857a-e7e53cec7c60","labels":{"en":"Julia Margaret Cameron","zh-Hans":"朱莉娅·玛格丽特·卡梅隆"}},{"candidate_id":"artist-candidate:1942ecb6-ca0e-58c5-9fca-7785d500b8cf","labels":{"en":"Katsushika Hokusai","zh-Hans":"葛饰北斋"}},{"candidate_id":"artist-candidate:0ca3f12a-9ae9-5644-916f-3d599f1967f8","labels":{"en":"Kitagawa Utamaro","zh-Hans":"喜多川歌麿"}},{"candidate_id":"artist-candidate:da02db61-430f-5d73-a97f-64b0e7a5ce26","labels":{"en":"Shen Zhou","zh-Hans":"沈周"}},{"candidate_id":"artist-candidate:f25c47aa-47bd-5009-b3fe-508b6cc9b039","labels":{"en":"Raja Ravi Varma","zh-Hans":"拉贾·拉维·瓦尔玛"}},{"candidate_id":"artist-candidate:ad5f2cda-6489-55d4-aa81-37be10697f58","labels":{"en":"José Guadalupe Posada","zh-Hans":"何塞·瓜达卢佩·波萨达"}},{"candidate_id":"artist-candidate:0bfcdd78-5be2-5903-9819-d3a3a1406698","labels":{"en":"Henry Ossawa Tanner","zh-Hans":"亨利·奥萨瓦·坦纳"}}],"resulting_batch_id":"art-batch:museum-03b-first-slate-v1","schema_version":"1.0.0","selected_candidate_ids":["artist-candidate:aba4e7b5-5cce-5903-98a3-debd6a8a30fe","artist-candidate:28386296-3385-5ef8-a959-9f1ef8ae7bc9","artist-candidate:708f8528-dbac-53f5-8fc7-bb15e816c0a5","artist-candidate:f92e77cc-b45b-5998-9707-879503c1dabf","artist-candidate:09ae6255-0541-57ef-9dcd-df1570ff2d62","artist-candidate:f1757502-ff5e-5769-857a-e7e53cec7c60","artist-candidate:1942ecb6-ca0e-58c5-9fca-7785d500b8cf","artist-candidate:0ca3f12a-9ae9-5644-916f-3d599f1967f8","artist-candidate:da02db61-430f-5d73-a97f-64b0e7a5ce26","artist-candidate:f25c47aa-47bd-5009-b3fe-508b6cc9b039","artist-candidate:ad5f2cda-6489-55d4-aa81-37be10697f58","artist-candidate:0bfcdd78-5be2-5903-9819-d3a3a1406698"],"stale_check":{"bundle_revalidated":true,"decision_hash_verified":true,"status":"fresh"},"submitted_decision_hash":"sha256:20dd0bf806dc06cc110140ece1b29838cf38ef8134ffa3f08f5ea82d256ba727","submitted_decision_id":"selection-decision:17bcd813-6a96-55e5-aed4-788df44ad006","validation_result":"pass"}